{"$schema":"https://json-schema.org/draft/2020-12/schema","$id":"https://mindclade.dev/schemas/feature-derivation-receipt/v1","title":"FeatureDerivationReceipt","type":"object","additionalProperties":false,"required":["schema_version","kind","metadata","spec","lineage","integrity"],"properties":{"schema_version":{"const":"mindclade.feature-derivation-receipt/v1"},"kind":{"const":"FeatureDerivationReceipt"},"metadata":{"$ref":"#/$defs/metadata"},"spec":{"type":"object","additionalProperties":false,"required":["plan","dataset","feature_bundle","cache_key","cache_key_verified","attempt_id","lease_epoch"],"properties":{"plan":{"$ref":"#/$defs/artifact_ref"},"dataset":{"$ref":"#/$defs/artifact_ref"},"feature_bundle":{"$ref":"#/$defs/artifact_ref"},"cache_key":{"$ref":"#/$defs/digest"},"cache_key_verified":{"const":true},"attempt_id":{"type":"string","minLength":1,"maxLength":128},"lease_epoch":{"type":"integer","minimum":1}}},"lineage":{"type":"array","minItems":2,"maxItems":64,"items":{"$ref":"#/$defs/artifact_ref"}},"integrity":{"$ref":"#/$defs/integrity"}},"$defs":{"digest":{"type":"string","pattern":"^sha256:[a-f0-9]{64}$"},"metadata":{"type":"object","additionalProperties":false,"required":["uid","created_at","producer","classification"],"properties":{"uid":{"type":"string","minLength":1,"maxLength":128},"created_at":{"type":"string","format":"date-time"},"producer":{"type":"string","minLength":1,"maxLength":128},"classification":{"enum":["PUBLIC","INTERNAL","RESTRICTED"]}}},"artifact_ref":{"type":"object","additionalProperties":false,"required":["uri","digest","media_type","schema_version"],"properties":{"uri":{"type":"string","pattern":"^artifacts/[A-Za-z0-9._~/-]+$"},"digest":{"$ref":"#/$defs/digest"},"media_type":{"type":"string","minLength":1,"maxLength":128},"schema_version":{"type":"string","minLength":1,"maxLength":128}}},"integrity":{"type":"object","additionalProperties":false,"required":["payload_digest"],"properties":{"payload_digest":{"$ref":"#/$defs/digest"},"evidence":{"type":"array","maxItems":32,"items":{"$ref":"#/$defs/artifact_ref"}}}}}}
