{"schema_version":"mindclade.feature-derivation-receipt/v1","kind":"FeatureDerivationReceipt","metadata":{"uid":"derivation-001","created_at":"2026-08-31T12:00:00Z","producer":"feature-worker","classification":"INTERNAL"},"spec":{"plan":{"uri":"artifacts/feature-plans/001","digest":"sha256:aaaaaaaaaaaaaaaaaaaaaaaaaaaaaaaaaaaaaaaaaaaaaaaaaaaaaaaaaaaaaaaa","media_type":"application/schema+json","schema_version":"mindclade.feature-plan/v1"},"dataset":{"uri":"artifacts/datasets/001","digest":"sha256:bbbbbbbbbbbbbbbbbbbbbbbbbbbbbbbbbbbbbbbbbbbbbbbbbbbbbbbbbbbbbbbb","media_type":"application/schema+json","schema_version":"mindclade.dataset-manifest/v1"},"feature_bundle":{"uri":"artifacts/feature-bundles/001","digest":"sha256:cccccccccccccccccccccccccccccccccccccccccccccccccccccccccccccccc","media_type":"application/schema+json","schema_version":"mindclade.feature-bundle/v1"},"cache_key":"sha256:dddddddddddddddddddddddddddddddddddddddddddddddddddddddddddddddd","cache_key_verified":true,"attempt_id":"attempt-001","lease_epoch":2},"lineage":[{"uri":"artifacts/feature-plans/001","digest":"sha256:aaaaaaaaaaaaaaaaaaaaaaaaaaaaaaaaaaaaaaaaaaaaaaaaaaaaaaaaaaaaaaaa","media_type":"application/schema+json","schema_version":"mindclade.feature-plan/v1"},{"uri":"artifacts/datasets/001","digest":"sha256:bbbbbbbbbbbbbbbbbbbbbbbbbbbbbbbbbbbbbbbbbbbbbbbbbbbbbbbbbbbbbbbb","media_type":"application/schema+json","schema_version":"mindclade.dataset-manifest/v1"}],"integrity":{"payload_digest":"sha256:eeeeeeeeeeeeeeeeeeeeeeeeeeeeeeeeeeeeeeeeeeeeeeeeeeeeeeeeeeeeeeee","evidence":[]}}
